{
	"$schema": "http://json-schema.org/draft-07/schema#",
	"type": "object",
	"properties": {
		"name": {
			"$ref": "#/definitions/name"
		},
		"revision": {
			"type": "string",
			"pattern": "^\\d*\\.\\d*\\.\\d*$"
		},
		"description": {
			"type": "string"
		},
		"id": {
			"type": "string"
		},
		"submodels": {
			"type": "object"
		}
	},
	"required": [
		"name",
		"revision",
		"id"
	],
	"definitions": {	
	"name": {
			"type": "string",
			"pattern": "^[A-Za-z_][A-Za-z0-9_]*$",
			"minLength": 3
			}
}
}